title,questions,answers
I can not find the three videos on this page,"Professor, Sorry, accordong to the message you sent to us, there should be three videos about Unix and Python. Unfortunately, I can not find them on this wedsite~ So could you please tell me where exactly the videos are? Best wishes",https://edstem.org/courses/1189/lessons/  here it is 
Peer study group,"Is anyone interested in forming a peer study group to meet on weekends (Saturday or Sunday) or weeknights (Tuesday or Friday) at UNSW/CBD? If you are interested, can you please comment below with your preferred time and location?",good idea~ let‘s form a group. 
Lecture_1 practice_Dict,I was trying to practise the turning machine example you taught in the lecture and I am struck with dictionary order when I run the for iteration in the instructions dictionary. I have attached the screen shots for your reference.The sequence of the keys in the output has changed surprisingly.,"Hi Phanindra, a dictionary is an unordered structure; we can iterate over all keys, but they are then enumerated in an order which is arbitrary, it can be different from machine to machine, and from run to run on a given machine."
Inaccuracy of standard deviation,"I am doing Lab_1 and find out that the standard deviation calculated manually is not consistent with the one calculated by standard module statistics. here is my code snippet
size = len(L)
L.sort()
mean = sum(L) / size
median = (L[size // 2] + L[size // 2 - 1]) / 2 if size % 2 == 0 else L[size // 2]
standard_deviation = sqrt(sum([(e-mean) ** 2 for e in L]) / size)
is inaccuracy caused by accumulated inaccuracy of float numbers calculation or I messed something up? Thanks

","Hi Tianle, I guess you are importing and using stdev rather than pstdev from the statistics module, hence estimate the the standard deviation from a sample rather than computing it from the population."
Doubt regarding enumerate(),"I had this doubt. I was looking at the functions in the Jupyter sheets where I came across this. Question : How is the output generated? For instance in the first command, the enumeration is being done in sorted/random manner? My thinking was that it would be sorting the set and then assigning integar values to get => [(0,10),(1,15),(2,25),(3,40)]. Is it being done randomly? If not what is happening behind the scene?

I tried with other command. Here too I am confused whats happening:",">>> type({100,200,300,400})

<class 'set'>

The type of {100,200,300,400} is 'set'. 'set' is unordered, so you cannot access the values using index unlike 'list' or 'tuple'.

More details: https://docs.python.org/3.6/library/stdtypes.html?highlight=set#set-types-set-frozenset"
Question about Drawing an Hexagram,"Dear Prof,

I'm wondering if there is some way to set the line colour to invisible, or set the line width = 0 so that I can just overwrite the filling other than the frame. Every time I draw a new triangle with line colour set to ('') and filling colour set to ('white') the prev just seem to kind of colour fading. I tried to read the python 3.6 turtle graphics documentation but I couldn't find my answers. So I post for help.

This question comes from my trying another way to draw an hexagram. That is, 
1) To draw a triangle with red line, white filling; adjust its direction;
2) To draw a new triangle with blue line, white filling; now I get this:3) To draw a new triangle in the same position as the first one, but with no line colour, and still white filling; now I get this:
Seems like I've got the right shape, but the line colour is lighter. To make it look better, I continuously draw the fourth triangle to overwrite the blue one. Finally I get this: 
In brief, how should I do to overwrite the filling to 'cut' the overlap lines but do nothing with the previous lines? I guess there may be some way like to set lines invisible or transparent...","Hi Tianpeng, I am sure you read the document at least as well as I did... The way I do it is draw one third of the line, then pen up and move by one third, then pen down and draw the remaining one third."
"
Lab","Silly question, are we to attend the lab tonight and complete the lab work with Matthew Perry,  6:30 to 8:30pm? Or is the session purely for people with queries only?


Promie ","Lab work is not assessed (there are no marks for it), these ""lab sessions"" are consultation for you to attend only if you have questions, if you need support."
Unix terminal issue,"As you have shown in the lecture, there are some commands operating on the terminal on your mac. however, the operating system I use on my laptop is windows 7 rather than Unix. So many commands you show on your mac are not recognized on my terminal. I wonder that are there equivalent commands for windows? Is it necessary for me to install a Unix operating system or use the virtual machine in order to catch you up on this terminal commands part? Am I going to get into further trouble if I keep running python on my windows system in this course?","Hi Xiaohan, there are indeed Windows equivalent to most Unix commands.

https://www.lemoda.net/windows/windows2unix/windows2unix.html
As the School machines are running Linux, and as I have a Mac, I can indeed only show you the Unix commands. It is not necessary for you to install a virtual machine on your windows machine, you can do so if you wish so, but it is not necessary for this course, you can score 100 in this course knowing nothing about the command line and Unix. I show you a few things which:

- can be used on a School machine

- provide some insights on working from the terminal (whatever the operating system happens to be).

You can ignore it, or practice it on a School machine, or see what the Windows equivalents are, or install Linux on your Windows machine; just go for the option that suits you."
Terminal software installation problems,"I followed the steps of the video software intallation Jupyter you posted. However, it didn't show the same results as it should be. Rather than the screenshot below, I don't know where is wrong and how to fix it up.","Hi Yufan, it is impossible for me to answer your question just based on this information, as all kinds of things could go wrong. I suggest you go to consultation tonight and ask the tutor to help out with this."
related to Workspaces,"I can not get access to the Jupyter notebook sheets on Workspaces. 

can you give me a permission to open it?  thank you . 

","Hi Jingchang, if you click on the Fork button, doesn't that create your own copy that you can work with?"
fstring doesn't work on drum,"python 3.5 doesn't have the f string feature and we don't have enough privilege to update new version of python on lab machine.

I can surely do the lab at home using my computer but it actually feels better going to the lab :D","I wrote somewhere, but I should have made it clearer, that on the School machines, you can run python3.6 by executing python3.6"
Lab_Q4 on standard deviation answer,,
How much maths knowledge is expected?,"Just wondering what the expected level of mathematics knowledge is, for when the closed book exams roll along. Using the current lab as an example, is calculating standard deviation manually (rather than having knowledge of and using the built-in maths/statistics modules) similar to anything we might encounter in the exams?","Hi Scott, I am not expecting you to remember any maths in the exam. The lectures and the labs sometimes have mathematical material, but it is usually treated as more advanced and optional. Commonsense is essentially all you need to do well in this course."
Lab1_task6 distance to the polygon edges,"I noticed you described ""distance from centre to edges of the octagon"" was 100, however when I drew it, I found unless I set the distance from centre to the vertices of the octagon as 100, the shape would not quite fit with your example. 

I measured your sample figure; ratio of (distance from the top of triangle to the centre) / (distance from edge to the centre) is close to 1.95, which is in fact 180 / 100 / cos(pi / 8), but rather, (distance from the top of triangle to the centre) / (distance from octagon vertices to the centre) is close to 180 / 100. That means you might have set""distance from centre to vertices of the octagon"" as 100, not distance to edges.","Hi Feng, indeed, I wanted to say, I should have said, ""distance to a vertex of the inscribed octagon"". Thanks for pointing this out.

To display Python code, you should not copy and paste it as text, but rather click on the <> button that allows you to insert Python code and run it:"
Lab exercise,Will lab exercise be uploaded anywhere? so that students who not attending the lab can have a look and do those exercise in their own time?,"Solutions are posted one week later, in Resources, and also under Challenges for the flagged ones."
Slack Group For Discussion,,
Jupyter Notes for Lecture 2,"Please if you also upload the Jupyter notes for today's lecture as you had uploaded for lecture 1.

You have uploaded the text file and not the Jupyter file.","Hi Himanshu, I have done it already, under Resources, and checking again, it seems to be the right file."
Submitting the Quiz,Has the way to submit the quiz been published? Or do we just complete it in Ed under assignments?,"You can edit the file directly in Ed, or you can download the file, edit it locally, and then upload it. Eventually you have to click the Submit button. You can submit it as many times as you like. The last submitted version will be assessed."
Quiz performance,"Quiz will be tested for performance? like with some really big numbers or it will be just the numbers we have in the pdf?

By performance i mean memory, runtime and algorithm?","No no no, the PDF and associated tests in Ed show just examples of outputs, it just illustrates what the exercise is about, but I will use other test cases, and testing has to be taken seriously (will talk
more about it on Monday). For this quiz, performance should not be an issue, the list won't be large."
query regarding quiz,"I am relatively new to programming environment,  is the quiz only to do testing on the output of the code or do we have to make any changes in the code. If I am wrong I request you to highlight what is required to do.",if you need more detail re-watch lecture video (2:21:45) on moddle where Eric explains the requirement(how the list should be generated).
About special case in Quiz 1,"If the current algorithm can handle the situation that there is only one element in the list, can we still call this situation a special case? In my opinion, classified discussion will be needed when the current method cannot handle some case. Am I correct?

Or we defined the 1-element situation a special case just because of the consideration about time complexity?","Hi Jianyu, if you prefer, we can talk about ""simplest cases"". An empty list is the simplest case. Then a list of length 1 is the next simplest case... We should include what we consider to be all ""simplest cases"" in our test cases."
How many line of code?,"Whoever finished the quiz1, would you mind sharing how many lines of code you wrote to complete M and N. Just to get a hint on improvement, I'm very sure mine can be reworked to someting smaller. 

Mine:

M = 11 Line

N = 14 Line","For this short coding competition, I just implemented 2 line code to create M, but I don't think that shorter implementation is always better because it doesn't guarantee performance or readability. 

We should be careful not to be blinded by tangible figures."
"Lab 2, Question 3","Hi there, I'm having trouble understanding what this question means.

It seems like it's asking to find all possible arrangements of numbers 1 - 9, in the pattern described, such that the multiplication is true and also the addition of the columns are all equal.

However the given examples do not hold true when arranged in this way. I also don't understand what the 4th and fifth rows of asterisks are meant to represent (possibly space for larger numbers, up to seven digits? and then a row representing the addition of the columns?) I'm obviously misunderstanding, is there some other way it can be explained?

","The two solutions show the multiplicand, the multiplier and the result of the multiplication (first, second and last line) but not the intermediate results (third and fourth lines)."
Shall I post lab code?,"I just find that the due date of chanllenge iscoming.

I am not sure if it is necessary to post the code.

Does or it is okay if we just practised it ourselves?","Hi Keqiao, as mentioned in course outline and during lectures, labs are just for you to practice, they are not assessed."
Please never share your code in any forum discussion,,"code can be posted after programs have been assessed (for quizzes and assignments) and after solutions have been released (for labs), but should not be posted before. This is of course essential for quizzes and assignments; posting code before submissions have been assessed is reprehensible and punishable by University policy on plagiarism. For labs, which are not assessed, it is indeed preferable to let everyone give their best shot for a week, till solutions are released. Then sharing code, comparing solutions, discussing the pros and cons of different designs and implementations, is a very valuable exercise. "
"Lab 2 ,Q2","Hi professor, I have a question about the definition of 'perfect numbers'. As you input 100, and the result is 6 and 28. Does that mean there is only 2 perfect numbers range from 1 to 100. So how to explain 12 = 1 + 2 + 3 + 6, I think that 12 also has the characteristics of perfect numbers. Is that included? Thanks","Hi, mathematically, perfect number is equal to the sum of its proper divisors. Proper divisors here means a divisor other than itself. So 6 and 28 is a perfect number because sum of proper divisors of 6 {1,2,3} is the number 6 itself. Hope this helps, thanks."
"Lab2, cycloidal_curves.pdf updated",,"The definition of period was incorrect in the original version, fixed in current version; thank you to Junnan Chen for having pointed it out."
lab2 perfect number,"I think '1' is also a perfect number because 1 is a only divisor for itself and 1=1,therefore, 1 could be a perfect number

Or 1 is special condition?","Hi Chenyang, we take only the proper divisors, meaning, excluding the number itself."
Course consultation,Hi can any one please tell me where exactly will be consultation conduction on tuesday from 6 30 pm to 8 30 pm.  I mean the location???,See course outline.
Problem with Quiz 1,"I was working on quiz 1 when I received an error and the code wouldn't execute anymore. I restarted by web browser and now I can't access quiz 1, it says ""There are no assignments yet. Check back later."".

I've tried restarting my browser, clearing history and cookies, logging out and back in, but I still can't access the quiz again to finish my attempt.

Is there something that I'm doing incorrectly to access the quiz?","Indeed, there is a problem,, no more message on this please, it might take some time to get back."
Quiz 1 disappeared,"The Quiz 1 disappeared on 22:30 PM,today, I notice that the due date is Thursday.

so I still code it...",It is back.
Case in Quiz 1,"In the special case (quiz 1, second exercise: N) in which all the elements on the right have been taken already, should I take the rightmost element in the list or start from the left?

Let's say L is: 4, 2, 3, 1, 4, 4

After three steps N will be: 4, 4, 4

L will be: 4, 2, 3, 1, 4, 4, with the underline meaning it is taken

The next number should be 2 (go to the end of the list and if they are all taken start from the beginning) or 1, which is the rightmost number available?

Thank you","Hi, If I understand correctly based on the test cases and also the description, when an index is taken, get back to the left-most and get the unused value. Please correct me if I am wrong, thanks."
Lab 1 Q1,"in Lab 1, Qu 1 why is there an f in the print output statement:

print(f'{Celsius ... }')

I get the same output when i remove the f and use:

print('{Celsius ...}')

is it redundant or are there cases where it is important to include the f before the quote mark?","It seems to be a new function in python3.6. It is used to format string literals. 

You can find the details in (PEP 498) https://docs.python.org/3/whatsnew/3.6.html"
Lab2 Bayes,"It seems that I have difficulties understanding the question. As far as I know, Bayes is about conditional probability. I do not see anything related to that from the question.  I think just randomly rolled the dice and then record the result. Can anyone explain this for me. Thanks.",You need to compute the probability of a die being the chosen die given the value that is rolled.
where to submit the completed program,where to submit the completed program,If you go to the assessments tab and then click on quiz 1 you can enter your code where the comment asking for it is and then press submit which is next to run. I hope this is the right way to submit it because that's what I did.
String M requires 5 numbers,"I'm afraid I don't understand your reasoning for the answer you're giving for string M where only 4 numbers are generated.   The instruction requests 5 numbers: 1) middle, 2) first, 3) last, 4) second and 5) penultimate .  Therefore when a list of only 4 numbers is generated in L, one number must be repeated to get the correct result.   

The sample PDF indicates: 

""The generated list L is:

[3, 3, 0, 2]

Here is M:

[0, 3, 2, 3]""

But my reading of the question, the correct result for M is:

[0, 3, 2, 3, 0]

Am I reading the question wrong?  ","I think Dr.Martin was just making an example with 5 numbers, which are middle, first, last, second and penultimate. If your list only has 4 digits, then you get M as middle(pop), first(pop), last(pop) and the current first element, aka the penultimate element of the original list L."
"Challenges - Mean, median, and standard deviation",,
Lab2 question1,,
Sample output for quiz 2,Is there a PDF for example output for quiz 2? I can't find it in the downloads section but I thought I saw it during the lecture.,"Hi Hon, it is there now."
Standard Library,"We are allowed to use any module from the standard library for quizzes, right?","Hi Rod, the answer is yes."
Question on quiz2,"If my input is 0 1 5, and I get a list of [3]. In this case, how would the output go? My output something like this:

The fractions no greater than 1 that can be built from L, from smallest to largest, are:

3

The fraction closest to 1/2 is 3

Is this correct? Or the output should be something else?","Hi Tiancong, no, recall that all fractions evaluate to 1 at most.

The generated list is:

[3]


The fractions no greater than 1 that can be built from L, from smallest to largest, are:

1

The fraction closest to 1/2 is 1"
For Quiz2,"If 1, 3, 9, 27 exists in generated List, how many ""1/3"" should show in fraction list?

1 or 3?","Hi Haotian, just 1."
"Quiz 2, error when testing","I think there might be an error in the expected answers for the quiz, as from test 5 and after there seems to be an extra 1 for the fractions no greater than 1.

Output for test 5:

The generated list is:

[12, 13, 1]


The fractions no greater than 1 that can be built from L, from smallest to largest, are:

-    1/13  1/12  12/13

+    1/13  1/12  12/13  1

The fraction closest to 1/2 is 1/12","Indeed, we take any pair of numbers a, b in the list, with a <= b, as we do not want to get a fraction greater than 1, and that gives us a/b, that we simplify, and output only once (what is unique is the fractions that we output). So indeed, we are sure to output 1 since our list contains at least one nonzero element (otherwise we exit), that we can divide by itself."
A Word Game characters,"For the assignment, ""A Word Game,"" if a character appears only once in the input, can it be used multiple times when forming a word?","Hi Rod, no, we consume occurrences of characters in the input."
A weird issue related to online submit,"A weird issue related to online submit
","Hi Qeqiao, I can only reiterate my advice not to modify the code already written. You made it an issue."
Pivoting Die Input,Is an input of a positive integer padded with spaces valid input?,"Hi Rod, it is, spaces are ignored when converting strings to ints.

"
Rubik’s rectangle,"My problem is the code consumes lots of time when I tested. The computing complexity increases exponentially with the steps, as a result, the code failed to pass the test when I tried to submit it online. My question is should I  optimize the algorithm to decrease the running time or it is just fine as the code output is correct.","Hi Jingming, every test will be run for 30 seconds, so your code should output a solution within that time, which should be much more than necessary. We will discuss an efficient approach to the problem."
Poker Dice,"In the pdf, it is mentioned that ""No die is kept by inputting nothing"". Does nothing include a string of whitespaces? Or should it show the error message?","Hi Rod, yes, ""nothing"" includes whitespace."
for Assignment question3,"When I submit my codes, it alarms that 'run_submissions.sh: line 40:   620 Done                    { sleep 0.2; echo ""eaeo rtsmnz"" | tee -a tmp_outputs.txt; }

-        622 Killed                  | python3 highest_scoring_words.py'

What's wrong with it?

","Hi Hangyu, that means that Ed killed your program as it did not produce the output in the allocated time (30 seconds), so you need to make your code more efficient."
Quiz 2 clarification question,"Is there any possibility that number 0 will be generated into list? In that case, x/0 may occur, then I assume a fraction of 0 should be printed?","0 should be included, as one of the test cases do have 0 as an answer."
Quiz 2 question,"Can someone please explain what the line below means?

- if ""fractions"" contains then 1/2, then the fact that 1/2 belongs to ""fractions"";

The part 'contains then 1/2' is confusing.","Yes, sorry, typo, should have read: if ""fractions"" contains 1/2, ."
generating list L,"1) With the three input arguments, is it possible to generated the singleton list [0]?

2) I thought 2, 2, 2 would be a valid input, but why does the program give up on these arguments?","If you examine the code, the program may generate a list of all 0s. However, it will also exit the program and print ""failed to generate one strictly positive number, giving up."".

It's because of the check below which is already in the scaffold.\"
Trying to implement doctest,"Can the PDF provided with the quiz be used as testfile for doctest?

if __name__ == '__main__':

    f()

    import doctest

    doctest.testfile(""C:\Users\honyu\OneDrive\2017 Semester 2\COM9021 Principles of Programming\Quiz\Quiz 2\quiz_2.pdf"")

I wrote the above code for it but I receive the following error.

SyntaxError: (unicode error) 'unicodeescape' codec can't decode bytes in position 2-3: truncated \UXXXXXXXX escape

What I'm trying to do is compare my program to the output provided in the sample output PDF using doctest.","That is probably because the quote you pasted is not the ASCII quote. You often need to edit parts of what you copy and paste from a pdf, quotes in particular."
Quiz 2 Question,"0 can not be a denominator, so what will happen if the genarated list is [0, 0, 0, 0, 0], or [0] ?","If this is the case, the program exits automatically. But element 0 can be in your generated list during random generation. In that case you'll have to figure out a way to handle it in your code.The program will automatically exit. It's handled by Eric's code."
Doubt quiz 2 output,"The output shows me a error as this:-

TypeError                                 Traceback (most recent call last)

<ipython-input-76-b57ecc11b82c> in <module>()

     95 

     96 print('\nThe fractions no greater than 1 that can be built from L, from smallest to largest, are:')

---> 97 print('  ', '  '.join(e for e in fractions))

     98 #print(fractions)

     99 if spot_on:


TypeError: sequence item 0: expected str instance, int found


And if I remove this line underlined above and just write print(fractions), it works fine for me. And the output shows me in the form of this:-

The generated list is:

[12, 13, 1]


The fractions no greater than 1 that can be built from L, from smallest to largest, are:

[Fraction(1, 13), Fraction(1, 12), Fraction(12, 13), 1]

The fraction closest to 1/2 is 1/12.

So is it fine to get the output as above??",Of course the above output is not fine. Ed shows you it is not fine. You can use f to format.
Testing quiz 2,"I finished the quiz 2 and tried to test it with different input rather than the sample. 

The result shown ""Exceeded CPU Time"" when I tried to enter a length larger than 67, for example ""0 67 10"". 

Do I need to change my code to make it more efficient?","Hi Kirsti, I will not test inputs longer than 1000 but still, as a valuable exercise, you should try and improve your code and deal with lists with one million elements."
Quiz 2 Question (Ed output different from my jupyter output),"Why my Ed quiz 2 output is different with my jupyter output , both of them have the same code inputted. I copy paste the code from my jupyter into the Ed.

",I think I accidentally delete a string from a print statement. I reset the code and paste it again and it works now. Thank you.
